no,grade,word,japanese,description,small_topic,medium_category,sentence,japanese_sentence
781,4,pink,ピンク,Pink color.,colors_and_shades,abstract_concepts,She likes pink.,彼女はピンクが好きです。
782,4,place,場所,A location.,location_and_position,city_places,This is a nice place.,ここはすてきな場所です。
783,4,plays,遊ぶ 三単現,Third person singular of play.,toys_and_games,leisure_hobbies,He plays soccer.,彼はサッカーをします。
784,4,presents,プレゼント,Gifts for someone.,giving_and_receiving,actions_mental_and_social,She gets many presents.,彼女はたくさんプレゼントをもらいます。
785,4,reading,読んでいる,Ing form of read.,literature_and_books,arts_visual_and_media,She is reading a book.,彼女は本を読んでいます。
786,4,reads,読む 三単現,Third person singular of read.,literature_and_books,arts_visual_and_media,He reads a book.,彼は本を読みます。
787,4,raining,雨が降っている,Weather with rain.,weather_rainy_stormy,nature_weather_and_space,It is raining now.,今雨が降っています。
788,4,runs,走る 三単現,Third person singular of run.,movement_walk_run,actions_physical,He runs fast.,彼は速く走ります。
789,4,sandwiches,サンドイッチ,Food between bread.,lunch_and_sandwiches,food_sweets_and_drinks,I eat sandwiches.,私はサンドイッチを食べます。
790,4,sells,売る 三単現,Third person singular of sell.,buying_and_selling,actions_mental_and_social,He sells fruit.,彼は果物を売ります。
791,4,shopping,買い物,Activity of buying things.,shops_and_retail,city_shops_and_service,She is shopping now.,彼女は今買い物をしています。
792,4,sitting,座っている,Ing form of sit.,daily_routines,actions_physical,He is sitting on the chair.,彼は椅子に座っています。
793,4,sleeping,寝ている,Ing form of sleep.,sleep_and_insomnia,health_wellness,The baby is sleeping.,赤ちゃんは寝ています。
794,4,smart,頭がいい,Clever and intelligent.,intelligence_and_wisdom,people_character,He is smart.,彼は頭がいいです。
795,4,speaks,話す 三単現,Third person singular of speak.,speaking_and_talking,actions_mental_and_social,She speaks English.,彼女は英語を話します。
796,4,story,物語,A tale or story.,literature_and_books,arts_visual_and_media,This is a good story.,これはよい物語です。
797,4,sure,もちろん,Expression of agreement.,agreement_and_refusal,daily_expressions,I am sure.,もちろんです。
798,4,takes,取る 三単現,Third person singular of take.,hand_actions_hold_take,actions_physical,He takes a bus.,彼はバスに乗ります。
799,4,tells,伝える 三単現,Third person singular of tell.,speaking_and_talking,actions_mental_and_social,She tells a story.,彼女は物語を話します。
800,4,thank,感謝する,To express thanks.,gratitude_and_apology,daily_expressions,We thank our teacher.,私たちは先生に感謝します。
801,4,too,あまりに,Also or overly.,quantity_and_amount,abstract_concepts,I am happy too.,私も嬉しいです。
802,4,trumpet,トランペット,Brass musical instrument.,musical_instruments,arts_music,He plays the trumpet.,彼はトランペットを演奏します。
803,4,us,私たちを,Object pronoun us.,language_learning,education_academics,He helps us.,彼は私たちを助けます。
804,4,violin,バイオリン,String musical instrument.,musical_instruments,arts_music,She plays the violin.,彼女はバイオリンを演奏します。
805,4,volleyball,バレーボール,Team sport with a ball.,sports_general,leisure_sports,We play volleyball.,私たちはバレーボールをします。
806,4,washing,洗っている,Ing form of wash.,laundry_and_washing,home_housework,She is washing the dishes.,彼女は皿を洗っています。
807,4,weekends,週末,Saturdays and Sundays.,week,abstract_time_and_space,I play soccer on weekends.,私は週末にサッカーをします。
808,4,what's,何が,Short form of what is.,language_learning,education_academics,What's this.,これは何ですか。
809,4,windows,窓(複数),Glass opening in a wall.,walls_and_windows,home_infrastructure,Open the windows.,窓を開けてください。
810,4,word,単語,Word in a language.,language_learning,education_academics,This is a new word.,これは新しい単語です。
811,4,writes,書く 三単現,Third person singular of write.,writing,education_academics,He writes a letter.,彼は手紙を書きます。
812,4,writing,書いている,Ing form of write.,writing,education_academics,She is writing a letter.,彼女は手紙を書いています。
813,4,hello,こんにちは,Friendly greeting word.,meeting_greetings,daily_expressions,Hello Tom.,こんにちはトム。
814,4,good morning,おはよう,Greeting used in am.,meeting_greetings,daily_expressions,Good morning Ms Sato.,おはようございます佐藤さん。
815,4,goodbye,さようなら,Word when leaving now.,parting_phrases,daily_expressions,Goodbye see you.,さようならまたね。
816,4,thank you,ありがとう,Words to show thanks.,gratitude_and_apology,daily_expressions,Thank you very much.,本当にありがとう。
817,4,sorry,ごめんなさい,Apology for mistake.,gratitude_and_apology,daily_expressions,Sorry I am late.,遅れてごめんなさい。
818,4,yes,はい,Word to agree or accept.,agreement_and_refusal,daily_expressions,Yes I do.,はいそうです。
819,4,no,いいえ,Word to say not true.,agreement_and_refusal,daily_expressions,No I am not.,いいえ違います。
820,4,please,お願いします,Polite way to ask.,commanding_and_requesting,actions_mental_and_social,Please help me.,どうか手伝ってください。
821,4,bus stop,バス停,Wait for bus here.,buses_and_stops,transport_road,She waits at the bus stop.,彼女はバス停で待ちます。
822,4,go home,帰宅する,Return to house.,movement_transport,actions_physical,I go home at five.,私は五時に帰宅します。
823,4,look at,～を見る,Watch something.,looking_and_observing,actions_mental_and_social,Look at this picture.,この絵を見てください。
824,4,listen to,～を聞く,Hear music or talk.,listening_and_hearing,actions_mental_and_social,I listen to music.,私は音楽を聞きます。
825,4,weekend,週末,Sat and Sun usually.,calendar_and_dates,abstract_time_and_space,I play soccer on the weekend.,私は週末にサッカーをします。
826,4,New Year,正月/新年,Jan 1 start year.,festivals_and_events,society_culture,We visit my grandparents at New Year.,私たちは正月に祖父母を訪ねます。
827,4,lunch box,お弁当箱,Case for meal food.,kitchen_utensils,home_housework,This is my lunch box.,これは私の弁当箱です。
828,4,People,人々,Many persons.,categories_and_groups,people_relationships,Many people came today.,今日はたくさんの人が来ました
829,4,Likes,好き 三単現,Third person singular of like.,love_and_affection,emotions_feelings,She likes music.,彼女は音楽が好きです。
830,4,At Home,家で,At your house.,daily_routines,home_living_spaces,I stayed at home today.,今日は家にいました。
831,4,Food,食べ物,Things to eat.,daily_routines,food_sweets_and_drinks,This food is delicious.,この食べ物はおいしいです。
832,4,Books,本,Things you read.,literature_and_books,arts_visual_and_media,I read many books.,私はたくさん本を読みます。
833,4,Went,行った,Past tense of go.,movement_transport,actions_physical,We went to Kyoto.,私たちは京都へ行きました。
834,4,Years,年,More than one year.,time_units,abstract_time_and_space,Ten years passed quickly.,10年が早く過ぎました。
835,4,Every Day,毎日,Each day.,frequency,abstract_time_and_space,I study every day.,私は毎日勉強します。
836,4,Years Old,歳,Age expression.,life_stages_and_events,people_character,He is ten years old.,彼は10歳です。
837,4,Played,遊んだ した,Past tense of play.,toys_and_games,leisure_hobbies,They played soccer.,彼らはサッカーをしました。
838,4,Said,言った,Past tense of say.,speaking_and_talking,actions_mental_and_social,She said hello.,彼女はこんにちはと言いました。
839,4,Took,取った,Past tense of take.,hand_actions_hold_take,actions_physical,I took a picture.,私は写真を撮りました。
840,4,Weeks,週,More than one week.,week,abstract_time_and_space,Two weeks passed.,2週間過ぎました。
841,4,Her Family,彼女の家族,Family members of her.,family_relations,people_relationships,Her family is kind.,彼女の家族は親切です。
842,4,I Want,ほしい,To want something.,goals_and_purpose,actions_mental_and_social,I want some water.,私は水がほしいです。
843,4,I'll Go,行くよ,I will go.,invitations_and_suggestions,actions_mental_and_social,I'll go tomorrow.,私は明日行きます。
844,4,Many People,たくさんの人,Large number of people.,quantity_and_amount,people_relationships,Many people came.,たくさんの人が来ました。
845,4,Picture Of,の写真,Photo of something.,photography,arts_visual_and_media,This is a picture of my dog.,これは私の犬の写真です。
846,4,This Weekend,今週末,This coming weekend.,calendar_and_dates,abstract_time_and_space,I will study this weekend.,私は今週末勉強します。
847,4,Got,手に入れた,Past tense of get.,giving_and_receiving,actions_mental_and_social,I got a letter.,私は手紙をもらいました。
848,4,Lessons,レッスン,Class time to learn.,teaching_and_learning,education_school_life,We had two lessons.,私たちは2時間授業がありました。
849,4,Sports,スポーツ,Games and exercise.,sports_general,leisure_sports,I like sports.,私はスポーツが好きです。
850,4,Studied,勉強した,Past tense of study.,teaching_and_learning,education_school_life,He studied math.,彼は数学を勉強しました。
851,4,Teachers,先生たち,People who teach.,teachers_and_staff,education_school_life,The teachers are busy.,先生たちは忙しいです。
852,4,Wants,ほしい 三単現,Third person singular of want.,goals_and_purpose,actions_mental_and_social,She wants tea.,彼女はお茶がほしいです。
853,4,Watched,見た,Past tense of watch.,movies_and_genres,arts_visual_and_media,We watched TV.,私たちはテレビを見ました。
854,4,Winner,勝者,Person who wins.,winning_and_losing,leisure_sports,He is the winner.,彼が勝者です。
855,4,Art Lessons,絵のレッスン,Lessons for art.,school_subjects_arts,education_school_life,She takes art lessons.,彼女は美術の授業を受けます。
856,4,His Father,彼の父,His dad.,family_relations,people_relationships,His father is tall.,彼のお父さんは背が高いです。
857,4,His Parents,彼の両親,His mother and father.,family_relations,people_relationships,His parents are kind.,彼の両親は親切です。
858,4,I Like,好き,I like something.,love_and_affection,emotions_feelings,I like apples.,私はりんごが好きです。
859,4,In Australia,オーストラリアで,In Australia.,country,transport_travel,He lives in Australia.,彼はオーストラリアに住んでいます。
860,4,In Canada,カナダで,In Canada.,country,transport_travel,She studied in Canada.,彼女はカナダで勉強しました。
861,4,In Japan,日本で,In Japan.,country,transport_travel,We live in Japan.,私たちは日本に住んでいます。
862,4,Next Month,来月,The month after this month.,month,abstract_time_and_space,We will travel next month.,私たちは来月旅行します。
863,4,On Thursday,木曜日に,On Thursday.,week,abstract_time_and_space,I play tennis on Thursday.,私は木曜日にテニスをします。
864,4,On Weekends,週末に,On Saturdays and Sundays.,week,abstract_time_and_space,I read books on weekends.,私は週末に本を読みます。
865,4,One Day,ある日,On one day.,calendar_and_dates,abstract_time_and_space,I want to visit there one day.,いつかそこを訪れたいです。
866,4,You Want,ほしい,You want something.,goals_and_purpose,actions_mental_and_social,Do you want juice?,ジュースがほしいですか。
867,4,Cards,カード,Small paper cards.,stationery_and_tools,work_office,These cards are new.,これらのカードは新しいです。
868,4,Days,日々,More than one day.,calendar_and_dates,abstract_time_and_space,Three days passed.,3日過ぎました。
869,4,Gloves,手袋,Clothing for hands.,fashion_accessories,fashion_accessories,These gloves are warm.,この手袋は暖かいです。
870,4,Loves,大好き 三単現,Third person singular of love.,love_and_affection,emotions_feelings,He loves music.,彼は音楽が大好きです。
871,4,Minutes,分,Time unit minutes.,time_units,abstract_time_and_space,Wait five minutes.,5分待ってください。
872,4,Today's,今日の,For today.,calendar_and_dates,abstract_time_and_space,Today's weather is nice.,今日の天気は良いです。
873,4,Yeah,うん,Casual yes.,agreement_and_refusal,daily_expressions,Yeah I know.,うん 知っています。
874,4,By Taxi,タクシーで,Using a taxi.,taxis_and_rideshare,transport_road,We went by taxi.,私たちはタクシーで行きました。
875,4,Coffee Shop,コーヒー店,Shop that sells coffee.,coffee_and_tea,dining_out,The coffee shop is busy.,その喫茶店は混んでいます。
876,4,Dinner With,と夕食,Have dinner together.,dinner_and_main_courses,food_sweets_and_drinks,I had dinner with Tom.,私はトムと夕食を食べました。
877,4,Five O'clock,5時,Time expression.,time_units,abstract_time_and_space,It is five o'clock.,5時です。
878,4,Fourteen Years Old,14歳,Age expression.,life_stages_and_events,people_character,She is fourteen years old.,彼女は14歳です。
879,4,Grape Juice,ぶどうジュース,Juice made from grapes.,juice_and_smoothies,food_sweets_and_drinks,I drank grape juice.,私はぶどうジュースを飲みました。
880,4,He Loves,大好き,He loves something.,love_and_affection,emotions_feelings,He loves soccer.,彼はサッカーが大好きです。
881,4,Her House,彼女の家,Her home.,house_types,home_living_spaces,Her house is near here.,彼女の家はこの近くです。
882,4,His Brother,彼の兄 弟,His brother.,family_relations,people_relationships,His brother runs fast.,彼の兄は速く走ります。
883,4,His House,彼の家,His home.,house_types,home_living_spaces,His house is large.,彼の家は大きいです。
884,4,His Room,彼の部屋,Room in his home.,bedroom_furniture,home_living_spaces,His room is clean.,彼の部屋はきれいです。
885,4,Hot Chocolate,ホットチョコレート,Hot sweet drink.,water_and_soft_drinks,food_sweets_and_drinks,I like hot chocolate.,私はホットチョコレートが好きです。
886,4,I Need,必要,I need something.,need,actions_mental_and_social,I need help.,助けが必要です。
887,4,Last Night,昨夜,Night before today.,past_present_future,abstract_time_and_space,I studied last night.,昨夜勉強しました。
888,4,Near Here,この近く,Close to this place.,location_and_position,city_places,The station is near here.,駅はこの近くです。
889,4,On Sunday,日曜日に,On Sunday.,week,abstract_time_and_space,We play baseball on Sunday.,私たちは日曜日に野球をします。
890,4,Practiced,練習した,Past tense of practice.,working_and_trying,actions_physical,I practiced piano.,私はピアノを練習しました。
891,4,Practiced Soccer,サッカーを練習した,Practice soccer.,soccer_and_baseball,leisure_sports,He practiced soccer.,彼はサッカーを練習しました。
892,4,Today's Special,本日のおすすめ,Special menu for today.,ordering_and_menu,dining_out,Today's special is fish.,今日のおすすめは魚です。
893,4,Very Happy,とても嬉しい,Feeling very happy.,happiness_and_joy,emotions_feelings,I am very happy.,私はとてもうれしいです。
894,4,You Bring,持ってきて,You bring something.,commanding_and_requesting,actions_mental_and_social,Can you bring it?,それを持ってきてくれますか。
895,4,You Like,好き,You like something.,love_and_affection,emotions_feelings,Do you like coffee?,コーヒーは好きですか。
896,4,Do You Want,ほしい,Ask if someone wants.,asking_condition,actions_mental_and_social,Do you want tea?,お茶がほしいですか。
897,4,Bicycle,自転車,Two wheel vehicle.,bicycles_and_cycling,transport_road,I have a bicycle.,私は自転車を持っています。
898,4,Came,来た,Past tense of come.,movement_transport,actions_physical,She came early.,彼女は早く来ました。
899,4,Choose,選ぶ,Pick one.,deciding_and_choosing,actions_mental_and_social,Choose one book.,1冊選んでください。
900,4,Kyoto,京都,Place name in Japan.,city_places,transport_travel,Kyoto has many temples.,京都には多くの寺があります。
901,4,Mountains,山々,High land areas.,mountains_and_valleys,nature_environment,The mountains are beautiful.,山々は美しいです。
902,4,Osaka,大阪,Place name in Japan.,city_places,transport_travel,Osaka is a big city.,大阪は大きな都市です。
903,4,Outside,外に,Not inside.,location_and_position,city_places,It is cold outside.,外は寒いです。
904,4,Stayed,滞在した,Past tense of stay.,hotels_and_lodging,transport_travel,We stayed there.,私たちはそこに滞在しました。
905,4,Students,生徒たち,People who study at school.,students_and_life,education_school_life,The students are reading.,生徒たちは読書しています。
906,4,Taking,している,Ing form of take.,language_learning,education_academics,He is taking notes.,彼はメモを取っています。
907,4,Temples,寺,Religious buildings.,churches_and_temples,society_culture,We visited temples.,私たちは寺を訪れました。
908,4,After Dinner,夕食のあとで,Time after dinner.,past_present_future,abstract_time_and_space,I read after dinner.,夕食後に読みます。
909,4,An Apple,りんご1つ,One apple.,fruits_berries_citrus,food_sweets_and_drinks,I ate an apple.,私はりんごを食べました。
910,4,At School,学校で,At a school.,education_school_life,education_school_life,She is at school.,彼女は学校にいます。
911,4,Baseball Game,野球の試合,Sports match baseball.,soccer_and_baseball,leisure_sports,We watched a baseball game.,私たちは野球の試合を見ました。
912,4,Be Home,家にいる,To stay at home.,daily_routines,home_living_spaces,I will be home soon.,私はすぐ家に着きます。
913,4,Big City,大きい町,Large city.,city_places,city_places,Tokyo is a big city.,東京は大都市です。
914,4,Blossoms,花,Flowers on trees.,flowers,nature_environment,The blossoms are pretty.,花がきれいです。
915,4,Cherry Blossoms,さくら,Cherry tree flowers.,flowers,nature_environment,Cherry blossoms bloom in spring.,桜は春に咲きます。
916,4,Bring It,それを持ってきて,Bring that thing.,commanding_and_requesting,actions_mental_and_social,Please bring it tomorrow.,明日それを持ってきてください。
917,4,Can Come,来られる,Possible to come.,ability_can,actions_mental_and_social,He can come today.,彼は今日来られます。
918,4,Can Help,手伝える,Possible to help.,helping_and_serving,actions_mental_and_social,I can help you.,私はあなたを手伝えます。
919,4,English Homework,英語の宿題,Homework for English.,homework_and_assignments,education_school_life,I finished English homework.,英語の宿題を終えました。
920,4,Every Weekend,毎週末,Each weekend.,frequency,abstract_time_and_space,We meet every weekend.,私たちは毎週末会います。
921,4,Every Year,毎年,Each year.,frequency,abstract_time_and_space,We visit there every year.,私たちは毎年そこを訪れます。
922,4,Five Minutes,5分,Time length five minutes.,duration,abstract_time_and_space,It takes five minutes.,5分かかります。
923,4,Four Weeks,4週間,Time length four weeks.,duration,abstract_time_and_space,Four weeks passed.,4週間過ぎました。
924,4,Fresh Fruits,新鮮な果物,Fruits that are fresh.,fruits_tropical_other,food_sweets_and_drinks,I bought fresh fruits.,私は新鮮な果物を買いました。
925,4,Good At,得意,Skillful at something.,grades_and_results,education_academics,She is good at math.,彼女は数学が得意です。
926,4,Got Up,起きた,Past tense of get up.,daily_routines,actions_physical,I got up early.,私は早く起きました。
927,4,Have Dinner,夕食を食べる,Eat dinner.,dinner_and_main_courses,food_sweets_and_drinks,We have dinner at seven.,私たちは7時に夕食を食べます。
928,4,Help With,を手伝う,Help someone with something.,helping_and_serving,actions_mental_and_social,Can you help with this?,これを手伝ってくれますか。
929,4,Home Early,早く家に,Go home early.,past_present_future,abstract_time_and_space,He came home early.,彼は早く帰宅しました。
930,4,Host Family,ホストファミリー,Family that hosts you.,family_relations,people_relationships,My host family is kind.,私のホストファミリーは親切です。
931,4,Housework,家事,Work you do at home.,home_housework,home_housework,I did housework.,私は家事をしました。
932,4,I Usually,たいてい,I do something often.,frequency,abstract_time_and_space,I usually walk home.,私はたいてい歩いて帰ります。
933,4,I'm Going,行くところ,I am going now.,movement_transport,actions_physical,I'm going now.,今行きます。
934,4,Learning,学ぶ,Study and learn.,teaching_and_learning,education_academics,She is learning English.,彼女は英語を学んでいます。
935,4,Liked,好きだった,Past tense of like.,love_and_affection,emotions_feelings,He liked the movie.,彼はその映画が好きでした。
936,4,Listened,聞いた,Past tense of listen.,listening_and_hearing,body_functions_and_senses,I listened carefully.,私は注意して聞きました。
937,4,Lived,住んでいた,Past tense of live.,daily_routines,home_living_spaces,We lived there.,私たちはそこに住んでいました。
938,4,Lives,住んでいる 三単現,Third person singular of live.,daily_routines,home_living_spaces,He lives in Tokyo.,彼は東京に住んでいます。
939,4,Looked,見た,Past tense of look.,looking_and_observing,body_functions_and_senses,She looked happy.,彼女は幸せそうでした。
940,4,Looking,見ている,Ing form of look.,looking_and_observing,body_functions_and_senses,I am looking outside.,私は外を見ています。
941,4,Lot,たくさん,A large amount.,quantity_and_amount,abstract_concepts,A lot of birds came.,たくさんの鳥が来ました。
942,4,Met,会った,Past tense of meet.,meeting_greetings,actions_mental_and_social,I met my friend.,私は友達に会いました。
943,4,Missed,逃した,Past tense of miss.,presence_and_absence,abstract_concepts,I missed the bus.,私はバスに乗り遅れました。
944,4,Movies,映画,Films to watch.,movies_and_genres,arts_visual_and_media,I like movies.,私は映画が好きです。
945,4,Number,数字,Count symbol.,mathematics_and_numbers,science_academic,What is your number?,あなたの番号は何ですか。
946,4,Older,年上,More old than someone.,comparison,life_stages_and_events,My brother is older.,私の兄は年上です。
947,4,Painted,絵を描いた,Past tense of paint.,painting_and_drawing,arts_visual_and_media,She painted flowers.,彼女は花を描きました。
948,4,Seeing,会っている,Ing form of see meet.,meeting_greetings,actions_mental_and_social,I enjoy seeing birds.,私は鳥を見るのが好きです。
949,4,Someday,いつか,At an unknown future time.,past_present_future,abstract_time_and_space,I will visit there someday.,いつかそこへ行きます。
950,4,Studying,勉強している,Ing form of study.,teaching_and_learning,education_school_life,He is studying now.,彼は今勉強しています。
951,4,Swam,泳いだ,Past tense of swim.,swimming_and_water_sports,leisure_sports,We swam in the sea.,私たちは海で泳ぎました。
952,4,Talk,話す,Speak with someone.,speaking_and_talking,actions_mental_and_social,Can we talk now?,今話せますか。
953,4,Told,話した,Past tense of tell.,speaking_and_talking,actions_mental_and_social,She told me a story.,彼女は私に話をしました。
954,4,Traveling,旅行している,Ing form of travel.,travel_and_tourism,transport_travel,Traveling is fun.,旅行は楽しいです。
955,4,Visited,訪れた,Past tense of visit.,travel_and_tourism,transport_travel,We visited Kyoto.,私たちは京都を訪れました。
956,4,Visiting,訪れている,Ing form of visit.,travel_and_tourism,transport_travel,She is visiting Osaka.,彼女は大阪を訪れています。
957,4,Watches,見る 三単現,Third person singular of watch.,movies_and_genres,arts_visual_and_media,He watches TV daily.,彼は毎日テレビを見ます。
958,4,Where's,どこ,Short form of where is.,asking_and_answering,daily_expressions,Where's my bag?,私のかばんはどこですか。
959,4,Won,勝った,Past tense of win.,winning_and_losing,leisure_sports,Our team won.,私たちのチームが勝ちました。
960,4,Asked,たずねた,Past tense of ask.,asking_and_answering,actions_mental_and_social,She asked a question.,彼女は質問しました。
961,4,Cakes,ケーキ,Sweet baked food.,cakes_and_desserts,food_sweets_and_drinks,These cakes are sweet.,これらのケーキは甘いです。
962,4,Calls,電話する 呼ぶ 三単現,Third person singular of call.,phone_and_email,actions_mental_and_social,He calls his mother every day.,彼は毎日母に電話します。
963,4,CD,CD,Music disc.,electronics,tech_digital,I bought a CD yesterday.,私は昨日CDを買いました。
