no,grade,word,japanese,english,pos,category,actors
427,3,romance,恋愛,a love story,noun,word,-
428,3,comedy,喜劇,funny story,noun,word,-
429,3,drama,ドラマ,serious story,noun,word,-
430,3,documentary,ドキュメンタリー,film about real events,noun,word,-
431,3,analyze,分析する,to study parts to understand,verb,word,-
432,3,celebrate,祝う,to have a party for something happy,verb,word,-
433,3,maintain,維持する,to keep something in a good state,verb,word,-
434,3,recall,思い出す,to remember again,verb,word,-
435,3,adapt,適応する,to change to fit a new situation,verb,word,-
436,3,estimate (verb),推定する,to guess a number or cost,verb,word,-
437,3,convince,説得する,to make someone believe and agree,verb,word,-
438,3,demonstrate,実演する,to show clearly by action,verb,word,-
439,3,fulfill,果たす,to do what you promised,verb,word,-
440,3,overcome,克服する,to win against a problem,verb,word,-
441,3,resist,抵抗する,to fight against something,verb,word,-
442,3,relate,関連づける,to connect one thing to another,verb,word,-
443,3,attempt,試みる,to try to do something hard,verb,word,-
444,3,confess,告白する,to say you did something wrong,verb,word,-
445,3,involve,関与させる,to include as a part,verb,word,-
446,3,observe,観察する,to watch carefully,verb,word,-
447,3,dare,思い切ってする,to be brave enough to do,verb,word,-
448,3,hesitate,ためらう,to stop before doing because unsure,verb,word,-
449,3,achieve,達成する,to reach a goal by effort,verb,word,-
450,3,inquire,問い合わせる,to ask for information,verb,word,-
451,3,inspire,感動させる,to give a strong good feeling,verb,word,-
452,3,predict,予測する,to say what will happen later,verb,word,-
453,3,neglect,怠る,to not do what you should do,verb,word,-
454,3,suggest,提案する,to give an idea to do,verb,word,-
455,3,transform,変える,to change completely,verb,word,-
456,3,reduce,減らす,to make less,verb,word,-
457,3,increase,増やす,to make more,verb,word,-
458,3,expand,拡大する,to make larger,verb,word,-
459,3,develop,発展させる,to grow and improve over time,verb,word,-
460,3,create,作り出す,to make something new,verb,word,-
461,3,produce,生産する,to make goods in large numbers,verb,word,-
462,3,consume,消費する,to use up food or energy,verb,word,-
463,3,apply,申し込む,to ask for something officially,verb,word,-
464,3,hire,雇う,to give someone a job,verb,word,-
465,3,fire,解雇する,to make someone lose a job,verb,word,-
466,3,retire,引退する,to stop working because of age,verb,word,-
467,3,manage,管理する,to control and lead,verb,word,-
468,3,operate,操作する,to make a machine work,verb,word,-
469,3,control,制御する,to make something go the way you want,verb,word,-
470,3,organize,組織する,to plan and put in order,verb,word,-
471,3,arrange,手配する,to put things in the right order,verb,word,-
472,3,contact,連絡する,to speak or write to someone,verb,word,-
473,3,inform,知らせる,to give information,verb,word,-
474,3,announce,発表する,to tell news to many people,verb,word,-
475,3,advertise,宣伝する,to tell people to buy something,verb,word,-
476,3,complain,苦情を言う,to say you are not happy,verb,word,-
477,3,apologize,謝る,to say you are sorry,verb,word,-
478,3,forgive,許す,to stop being angry,verb,word,-
479,3,blame,責める,to say someone caused a problem,verb,word,-
480,3,deny,否定する,to say something is not true,verb,word,-
481,3,admit,認める,to say something is true,verb,word,-
482,3,ignore,無視する,to not pay attention,verb,word,-
483,3,avoid,避ける,to stay away from,verb,word,-
484,3,prevent,防ぐ,to stop something from happening,verb,word,-
485,3,protect,守る,to keep safe,verb,word,-
486,3,save,救う,to keep someone from danger,verb,word,-
487,3,rescue,救助する,to save from danger,verb,word,-
488,3,escape,逃げる,to get away from danger,verb,word,-
489,3,attack,攻撃する,to try to hurt,verb,word,-
490,3,defend,守る,to protect from attack,verb,word,-
491,3,compete,競争する,to try to win against others,verb,word,-
492,3,participate,参加する,to take part,verb,word,-
493,3,volunteer,ボランティアをする,to work to help without pay,verb,word,-
494,3,support,支える,to help and give strength,verb,word,-
495,3,donate,寄付する,to give money or goods to help,verb,word,-
496,3,contribute,貢献する,to help a group succeed,verb,word,-
497,3,serve,役に立つ,to work to help people,verb,word,-
498,3,deliver,配達する,to bring goods to a place,verb,word,-
499,3,transport,運ぶ,to move people or goods,verb,word,-
500,3,interrupt,さえぎる,to stop someone speaking,verb,word,-
501,3,disturb,邪魔する,to make it hard to do something,verb,word,-
502,3,damage,損なう,to harm something,verb,word,-
503,3,repair,修理する,to fix a broken thing,verb,word,-
504,3,replace,取り替える,to put a new one instead,verb,word,-
505,3,collect,集める,to gather many things,verb,word,-
506,3,gather,集まる,to come together,verb,word,-
507,3,contain,含む,to have something inside,verb,word,-
508,3,include,含む,to have as a part,verb,word,-
509,3,exclude,除く,to not include,verb,word,-
510,3,depend,依存する,to need something to happen,verb,word,-
511,3,prefer,好む,to like one thing more,verb,word,-
512,3,hate,憎む,to dislike strongly,verb,word,-
513,3,regret,後悔する,to feel sorry about a past act,verb,word,-
514,3,miss,恋しく思う,to feel sad without someone,verb,word,-
515,3,encourage,励ます,to give hope and courage,verb,word,-
516,3,discourage,やる気をなくさせる,to make someone lose courage,verb,word,-
517,3,embarrass,困らせる,to make someone feel shy,verb,word,-
518,3,frighten,怖がらせる,to make someone afraid,verb,word,-
519,3,surprise,驚かせる,to make someone feel surprised,verb,word,-
520,3,impress,感心させる,to make someone feel respect,verb,word,-
521,3,excite,わくわくさせる,to make someone feel excited,verb,word,-
522,3,interest (verb),興味を持たせる,to make someone want to know,verb,word,-
523,3,bore,退屈させる,to make someone feel bored,verb,word,-
524,3,relax (rest),くつろがせる,to make someone calm,verb,word,-
525,3,stress (verb),強調する,to make a point seem important,verb,word,-
526,3,focus,集中する,to put attention on one thing,verb,word,-
527,3,concentrate,集中する,to focus strongly,verb,word,-
528,3,imagine,想像する,to make a picture in your mind,verb,word,-
529,3,expect,予想する,to think something will happen,verb,word,-
530,3,realize,気づく,to begin to understand clearly,verb,word,-
531,3,recognize,見分ける,to know by seeing,verb,word,-
532,3,identify,特定する,to say what something is,verb,word,-
533,3,compare,比べる,to look for differences and similarities,verb,word,-
534,3,measure,測る,to find size or amount,verb,word,-
535,3,calculate,計算する,to find an answer by math,verb,word,-
536,3,count,数える,to say numbers in order,verb,word,-
537,3,solve,解決する,to find an answer to a problem,verb,word,-
538,3,fix (problem),解決する,to solve a problem,verb,word,-
539,3,improve (skill),上達する,to become better,verb,word,-
540,3,practice (skill),練習する,to do again to get better,verb,word,-
541,3,review,復習する,to study again,verb,word,-
542,3,memorize,暗記する,to learn so you can remember,verb,word,-
543,3,mention,言及する,to say something briefly,verb,word,-
544,3,express,表現する,to show by words or actions,verb,word,-
545,3,describe,描写する,to tell what something is like,verb,word,-
546,3,represent,表す,to stand for something,verb,word,-
547,3,print,印刷する,to put words on paper by machine,verb,word,-
548,3,publish,出版する,to make a book for the public,verb,word,-
549,3,share,共有する,to use or show with others,verb,word,-
550,3,post (online),投稿する,to put a message online,verb,word,-
551,3,download (file),取り込む,to take a file from the internet,verb,word,-
552,3,upload (file),送る,to put a file on the internet,verb,word,-
553,3,connect,つなぐ,to join together,verb,word,-
554,3,disconnect,切断する,to break a connection,verb,word,-
555,3,charge (battery),充電する,to put power into a battery,verb,word,-
556,3,record,記録する,to save sound or information,verb,word,-
557,3,save (data),保存する,to keep data for later,verb,word,-
558,3,update,更新する,to make something new again,verb,word,-
559,3,enter (data),入力する,to put information into a form,verb,word,-
560,3,register,登録する,to sign up with your name,verb,word,-
561,3,subscribe,購読する,to pay to get a service regularly,verb,word,-
562,3,cancel,取り消す,to stop a plan,verb,word,-
563,3,reserve,予約する,to keep a seat or room for later,verb,word,-
564,3,confirm,確認する,to check and make sure,verb,word,-
565,3,delay,遅らせる,to make later,verb,word,-
566,3,postpone,延期する,to move to a later time,verb,word,-
567,3,continue,続ける,to keep doing,verb,word,-
568,3,quit,やめる,to stop doing something,verb,word,-
569,3,pretend,ふりをする,to act like something is true,verb,word,-
570,3,behave,ふるまう,to act in a certain way,verb,word,-
571,3,obey,従う,to do what a rule says,verb,word,-
572,3,disobey,従わない,to not obey,verb,word,-
573,3,compliment,ほめる,to say something good about someone,verb,word,-
574,3,criticize,批判する,to say what is wrong,verb,word,-
575,3,approve,賛成する,to say yes officially,verb,word,-
576,3,disapprove,反対する,to say no officially,verb,word,-
577,3,permit,許可する,to allow,verb,word,-
578,3,forbid,禁じる,to not allow,verb,word,-
579,3,refuse,断る,to say no,verb,word,-
580,3,accept,受け入れる,to say yes and take,verb,word,-
581,3,insist,言い張る,to say strongly and not change,verb,word,-
582,3,request (verb),頼む,to ask formally,verb,word,-
583,3,demand,要求する,to ask strongly for something,verb,word,-
584,3,negotiate,交渉する,to talk to reach agreement,verb,word,-
585,3,hire out,貸し出す,to rent to others,verb,phrase,-
586,3,rent,借りる,to pay money to use for a time,verb,word,-
587,3,own,所有する,to have as yours,verb,word,-
588,3,belong,属する,to be owned by,verb,word,-
589,3,owe,借りがある,to need to pay back,verb,word,-
590,3,afford,余裕がある,to have enough money for,verb,word,-
591,3,earn,稼ぐ,to get money by working,verb,word,-
592,3,invest,投資する,to put money in to get more later,verb,word,-
593,3,waste,むだにする,to use badly and lose,verb,word,-
594,3,save up,貯金する,to save money over time,verb,phrase,-
595,3,borrow money,お金を借りる,to take money and pay back later,phrase,phrase,-
596,3,pay back,返済する,to return money you owe,verb,phrase,-
597,3,break the ice,場を和ませる,do something to make people relaxed,idiom,idiom,-
598,3,hit the hay,寝る,go to bed and sleep,idiom,idiom,-
599,3,kick the bucket,死ぬ,die,idiom,idiom,-
600,3,let the cat out of the bag,秘密を漏らす,tell a secret by mistake,idiom,idiom,-
601,3,piece of cake,朝飯前,very easy thing,idiom,idiom,-
602,3,spill the beans,秘密をばらす,tell a secret,idiom,idiom,-
603,3,take the bull by the horns,勇敢に立ち向かう,deal with a problem directly,idiom,idiom,-
604,3,the ball is in your court,あなたの番だ,it is your turn to act,idiom,idiom,-
605,3,throw in the towel,あきらめる,stop trying because you think you cannot win,idiom,idiom,-
606,3,under the weather,体調が悪い,feeling sick,idiom,idiom,-
607,3,on the other hand,一方で,used to show a different side,phrase,phrase,-
608,3,in my opinion,私の意見では,used to say what you think,phrase,phrase,A
609,3,as a result,その結果,because of that,phrase,phrase,-
610,3,in addition,さらに,also and more,phrase,phrase,-
611,3,for a reason,理由があって,for a cause,phrase,phrase,-
612,3,at the moment,今のところ,now,phrase,phrase,-
613,3,in general,一般に,generally,phrase,phrase,-
614,3,at least,少なくとも,not less than,phrase,phrase,-
615,3,at most,多くても,no more than,phrase,phrase,-
616,3,in the future,将来に,at a later time,phrase,phrase,-
617,3,in the past,過去に,before now,phrase,phrase,-
618,3,once in a while,たまに,not often,phrase,phrase,-
619,3,from the beginning,最初から,starting at the first time,phrase,phrase,-
620,3,all of a sudden,突然,very suddenly,phrase,phrase,-
621,3,as soon as possible,できるだけ早く,as quickly as you can,phrase,phrase,-
622,3,be supposed to A,Aすることになっている,expected to do,phrase,phrase,A
623,3,be able to A,Aできる,can do,phrase,phrase,A
624,3,used to A,以前はAした,past habit,phrase,phrase,A
625,3,get used to A,Aに慣れる,become used to,phrase,phrase,A
626,3,be interested in A,Aに興味がある,want to know about,phrase,phrase,A
627,3,be proud of A,Aを誇りに思う,feel proud about,phrase,phrase,A
628,3,be afraid of A,Aが怖い,feel fear,phrase,phrase,A
629,3,be responsible for A,Aの責任がある,have a duty for,phrase,phrase,A
630,3,be satisfied with A,Aに満足している,feel happy with,phrase,phrase,A
631,3,be familiar with A,Aに詳しい,know well,phrase,phrase,A
632,3,be aware of A,Aに気づいている,know about,phrase,phrase,A
633,3,be ready for A,Aの準備ができている,prepared for,phrase,phrase,A
634,3,depend on A,Aに頼る,need A to happen,phrase,phrase,A
635,3,deal with A,Aに対処する,handle a problem,phrase,phrase,A
636,3,look up A,Aを調べる,find information in a book,phrase,phrase,A
637,3,figure out A,Aを理解する,find an answer by thinking,phrase,phrase,A
638,3,run out of A,Aがなくなる,have no more,phrase,phrase,A
639,3,make sure,確かめる,check to be certain,phrase,phrase,A
640,3,make a decision,決断する,decide,phrase,phrase,A
641,3,take responsibility,責任を取る,accept duty for a result,phrase,phrase,A
642,3,take notes,メモを取る,write short points,phrase,phrase,A
643,3,make a mistake,間違える,do something wrong,phrase,phrase,A
644,3,catch a cold,風邪をひく,become sick with a cold,phrase,phrase,A
645,3,have a fever,熱がある,have high body heat,phrase,phrase,A
646,3,get injured,けがをする,become hurt,phrase,phrase,A
647,3,take medicine,薬を飲む,use medicine,phrase,phrase,A
648,3,call an ambulance,救急車を呼ぶ,ask for an ambulance,phrase,phrase,A
649,3,report a crime,犯罪を通報する,tell police about a crime,phrase,phrase,A
650,3,protect the environment,環境を守る,keep nature safe,phrase,phrase,A
651,3,save energy,節電する,use less energy,phrase,phrase,A
652,3,reduce waste,ごみを減らす,make trash less,phrase,phrase,A
653,3,recycle bottles,ボトルをリサイクルする,use bottles again,phrase,phrase,A
654,3,take action,行動する,do something to change a situation,phrase,phrase,A
655,3,make progress,進歩する,move forward and improve,phrase,phrase,A
656,3,reach a goal,目標に達する,achieve a goal,phrase,phrase,A
657,3,pass an exam,試験に合格する,succeed in a test,phrase,phrase,A
658,3,fail an exam,試験に落ちる,not pass a test,phrase,phrase,A
659,3,apply for A,Aに申し込む,ask officially to get,phrase,phrase,A
660,3,get a job,仕事に就く,start working,phrase,phrase,A
661,3,lose a job,職を失う,stop having a job,phrase,phrase,A
662,3,work overtime,残業する,work extra hours,phrase,phrase,A
663,3,earn money,お金を稼ぐ,get money by working,phrase,phrase,A
664,3,spend time,時間を使う,use time,phrase,phrase,A
665,3,spend money,お金を使う,use money to buy,phrase,phrase,A
666,3,save money,お金を貯める,keep money for later,phrase,phrase,A
667,3,waste time,時間を無駄にする,use time badly,phrase,phrase,A
668,3,waste money,お金を無駄にする,spend without good reason,phrase,phrase,A
669,3,make a reservation,予約する,reserve a place,phrase,phrase,A
670,3,confirm a reservation,予約を確認する,check a reservation,phrase,phrase,A
671,3,change a schedule,予定を変える,make the schedule different,phrase,phrase,A
672,3,miss a deadline,締め切りに間に合わない,not finish by the last time,phrase,phrase,A
673,3,meet a deadline,締め切りを守る,finish by the last time,phrase,phrase,A
674,3,keep a promise,約束を守る,do what you said you will do,phrase,phrase,A
675,3,break a promise,約束を破る,not do what you promised,phrase,phrase,A
676,3,make an excuse,言い訳をする,give an excuse,phrase,phrase,A
677,3,tell the truth,真実を言う,say what is true,phrase,phrase,A
678,3,keep a secret,秘密を守る,not tell others,phrase,phrase,A
679,3,spread a rumor,うわさを広める,make a rumor go around,phrase,phrase,A
680,3,rumor,うわさ,story that may not be true,noun,word,-
681,3,gossip,うわさ話,talk about other people,noun,word,-
682,3,conflict,対立,strong disagreement,noun,word,-
683,3,solution,解決策,an answer to a problem,noun,word,-
684,3,strategy,戦略,plan to reach a goal,noun,word,-
685,3,role model,手本,a person you want to be like,phrase,phrase,-
686,3,leadership,指導力,ability to lead people,noun,word,-
687,3,teamwork,協力,working well with others,noun,word,-
688,3,communication skill,会話力,ability to share information well,phrase,phrase,-
689,3,confidence,自信,feeling sure of yourself,noun,word,-
690,3,motivation,やる気,reason to work hard,noun,word,-
691,3,attitude,態度,way you think and act,noun,word,-
692,3,behavior,行動,what a person does,noun,word,-
693,3,personality,性格,how a person usually is,noun,word,-
694,3,character (personality),性格,personality,noun,word,-
695,3,identity,身元・自分らしさ,who a person is,noun,word,-
696,3,experience,経験,things you did and saw,noun,word,-
697,3,knowledge,知識,what you know,noun,word,-
698,3,skill (ability),技術,ability learned by practice,noun,word,-
699,3,ability,能力,power to do something,noun,word,-
700,3,permission slip,許可証,school paper that gives permission,phrase,phrase,-
701,3,field trip,校外学習,school trip to learn outside,phrase,phrase,-
702,3,exchange student,交換留学生,student studying in another country,phrase,phrase,-
703,3,international exchange,国際交流,sharing between countries,phrase,phrase,-
704,3,cultural difference,文化の違い,difference between cultures,phrase,phrase,-
705,3,language barrier,言葉の壁,problem from not sharing a language,phrase,phrase,-
706,3,homestay,ホームステイ,staying with a family in travel,noun,word,-
707,3,host family,受け入れ家庭,family that hosts a guest,phrase,phrase,-
708,3,customs officer,税関職員,person who checks bags at customs,phrase,phrase,-
709,3,passport control,入国審査,place that checks passports,phrase,phrase,-
710,3,boarding pass,搭乗券,paper to get on a plane,phrase,phrase,-
711,3,departure gate,搭乗口,place to board a plane,phrase,phrase,-
712,3,carry-on bag,機内持ち込み手荷物,small bag you take on a plane,phrase,phrase,-
713,3,luggage claim,手荷物受取所,place to get bags at an airport,phrase,phrase,-
714,3,accommodation,宿泊先,place to stay when traveling,noun,word,-
715,3,sightseeing,観光,visiting places for fun,noun,word,-
716,3,tour guide,観光案内人,person who guides tourists,phrase,phrase,-
717,3,landmark,名所,well known place in a city,noun,word,-
718,3,entrance fee,入場料,money paid to enter,phrase,phrase,-
719,3,admission,入場,permission to enter,noun,word,-
720,3,reservation number,予約番号,number for a reservation,phrase,phrase,-
721,3,customer review,口コミ,opinion written by customers,phrase,phrase,-
722,3,comment,コメント,short opinion in words,noun,word,-
723,3,complaint desk,苦情窓口,place to talk about problems,phrase,phrase,-
724,3,refund,返金,money returned after paying,noun,word,-
725,3,refund (verb),返金する,to give money back,verb,word,-
726,3,exchange (return),交換,to change one item for another,noun,word,-
727,3,exchange (verb),交換する,to change things with another,verb,word,-
728,3,guarantee,保証,promise that something will work,noun,word,-
729,3,warranty,保証書,paper that shows a guarantee,noun,word,-
730,3,damage (break),破損,physical harm to an object,noun,word,-
731,3,broken,壊れた,not working,adjective,word,-
732,3,repair cost,修理費,price to repair,phrase,phrase,-
733,3,delivery fee,配送料,price to deliver,phrase,phrase,-
734,3,service charge,サービス料,extra money added for service,phrase,phrase,-
735,3,tax,税金,money paid to the government,noun,word,-
736,3,discount,割引,lower price,noun,word,-
737,3,coupon,クーポン,paper that gives a discount,noun,word,-
738,3,bargain,お買い得,thing sold for a low price,noun,word,-
739,3,receipt,領収書,paper showing you paid,noun,word,-
740,3,application form,申込書,paper to apply,phrase,phrase,-
741,3,identity card,身分証,card that shows who you are,phrase,phrase,-
742,3,entry,応募,act of joining a contest,noun,word,-
743,3,deadline (date),期限,last date to do something,noun,word,-
744,3,turn in,提出する,give work to a teacher,verb,phrase,-
745,3,hand in,提出する,turn in,verb,phrase,-
746,3,look over,ざっと見る,read quickly to check,verb,phrase,-
747,3,go over,復習する,review,verb,phrase,-
748,3,come up with A,Aを思いつく,think of an idea,phrase,phrase,A
749,3,bring up A,Aを持ち出す,start talking about a topic,phrase,phrase,A
750,3,carry out A,Aを実行する,do a plan,phrase,phrase,A
751,3,set up A,Aを設立する,make and start,phrase,phrase,A
752,3,give up,あきらめる,stop trying,verb,phrase,-
753,3,keep on,続ける,continue,verb,phrase,-
754,3,put off A,Aを延期する,postpone,phrase,phrase,A
755,3,find out A,Aを知る,learn by searching,phrase,phrase,A
756,3,work out,うまくいく,have a good result,verb,phrase,-
757,3,run into A,Aに偶然会う,meet by chance,phrase,phrase,A
758,3,look after A,Aの世話をする,take care of,phrase,phrase,A
759,3,come across A,Aを偶然見つける,find by chance,phrase,phrase,A
760,3,make up,仲直りする,be friends again after a fight,verb,phrase,-
761,3,make up a story,話を作る,create a story that may be false,phrase,phrase,A
762,3,break down,故障する,stop working,verb,phrase,-
763,3,look down on A,Aを見下す,think someone is not good,phrase,phrase,A
764,3,look up to A,Aを尊敬する,respect,phrase,phrase,A
765,3,stand out,目立つ,be easy to notice,verb,phrase,-
766,3,turn out,結果になる,happen in the end,verb,phrase,-
767,3,point out A,Aを指摘する,tell someone about a point,phrase,phrase,A
768,3,settle,解決する,bring to an end,verb,word,-
769,3,settlement,解決,ending of a problem,noun,word,-
770,3,conclusion,結論,final decision or idea,noun,word,-
771,3,conclude,結論づける,to decide after thinking,verb,word,-
772,3,summary,要約,short statement of main points,noun,word,-
773,3,summarize,要約する,to make a short summary,verb,word,-
774,3,topic,話題,subject of a talk,noun,word,-
775,3,issue,問題,a topic people discuss,noun,word,-
776,3,concern,心配・関心,worry or interest,noun,word,-
777,3,concerned,心配して,worried,adjective,word,-
778,3,anxiety,不安,feeling of worry,noun,word,-
779,3,confidence (trust),信頼,strong belief in someone,noun,word,-
780,3,reliable,信頼できる,able to be trusted,adjective,word,-
781,3,unreliable,当てにならない,not reliable,adjective,word,-
782,3,efficient,効率的な,doing well without waste,adjective,word,-
783,3,inefficient,非効率な,not efficient,adjective,word,-
784,3,alternative,代わりの,another choice,adjective,word,-
785,3,alternative (noun),代案,another choice,noun,word,-
786,3,priority,優先,most important thing to do first,noun,word,-
787,3,priority (high),優先の,more important than others,adjective,word,-
788,3,consequence,結果,bad or good result of an act,noun,word,-
789,3,impact,影響,strong effect,noun,word,-
790,3,trend,流行・傾向,change that many people follow,noun,word,-
791,3,average,平均,usual level of a group,noun,word,-
792,3,average (adj),平均の,not special and in the middle,adjective,word,-
793,3,standard,基準,a level used to compare,noun,word,-
794,3,standard (adj),標準の,usual and accepted,adjective,word,-
795,3,topic sentence,主題文,main sentence in a paragraph,phrase,phrase,-
796,3,paragraph,段落,group of sentences in writing,noun,word,-
797,3,context,文脈,words around to show meaning,noun,word,-
798,3,highlight,強調する,to make something easy to notice,verb,word,-
799,3,emphasize,強調する,to stress an important point,verb,word,-
800,3,clarify,明確にする,to make clear,verb,word,-
1,2.5,acquire,得る・身につける,to get something over time,verb,word,-
2,2.5,achieve (reach),達成する,to reach a goal,verb,word,-
3,2.5,adaptation,適応,change to fit a new situation,noun,word,-
4,2.5,administrator,管理者,person who manages a school or office,noun,word,-
5,2.5,advertiser,広告主,person or company that makes ads,noun,word,-
6,2.5,affect,影響する,to change how something happens,verb,word,-
7,2.5,agency,機関,group that does a public job,noun,word,-
8,2.5,agriculture,農業,farming work to grow food,noun,word,-
9,2.5,aid (help),援助,help given to people,noun,word,-
10,2.5,airline,航空会社,company that flies planes,noun,word,-
11,2.5,alarm,警報,thing that warns of danger,noun,word,-
12,2.5,alcohol,アルコール,drink that can make you drunk,noun,word,-
13,2.5,alternative energy,代替エネルギー,energy not from oil or gas,phrase,phrase,-
14,2.5,ambition,野心,strong wish to succeed,noun,word,-
15,2.5,annual,年1回の,happening once each year,adjective,word,-
16,2.5,analyze (study),分析する,to study and understand parts,verb,word,-
17,2.5,ancient (old),古代の,very old from long ago,adjective,word,-
