no,grade,word,japanese,english,pos,category,actors
284,4,thick,厚い,not thin,adjective,word,-
285,4,thin,薄い,not thick,adjective,word,-
286,4,empty,空の,with nothing inside,adjective,word,-
287,4,full,いっぱいの,with no more space,adjective,word,-
288,4,rich,金持ちの,with a lot of money,adjective,word,-
289,4,poor,貧しい,with little money,adjective,word,-
290,4,lucky,運のいい,with good luck,adjective,word,-
291,4,unlucky,運の悪い,with bad luck,adjective,word,-
292,4,modern,現代の,new and of today,adjective,word,-
293,4,traditional,伝統的な,from old ways,adjective,word,-
294,4,private,私的な,only for one person or group,adjective,word,-
295,4,public,公の,for all people,adjective,word,-
296,4,possible ,あり得る,able to happen,adjective,word,-
297,4,immediate,すぐの,without waiting,adjective,word,-
298,4,quick,すばやい,fast,adjective,word,-
299,4,slowly,ゆっくり,not fast,adverb,word,-
300,4,quickly,すばやく,in a fast way,adverb,word,-
301,4,carefully,注意深く,in a careful way,adverb,word,-
302,4,easily,簡単に,in an easy way,adverb,word,-
303,4,exactly,正確に,in an exact way,adverb,word,-
304,4,especially,特に,more than other things,adverb,word,-
305,4,probably,たぶん(ある程度確信している),likely,adverb,word,-
306,4,maybe,たぶん(五分五分),perhaps,adverb,word,-
307,4,certainly,確かに,without doubt,adverb,word,-
308,4,actually,実は,in fact,adverb,word,-
309,4,finally,ついに,in the end,adverb,word,-
310,4,suddenly,突然,all at once,adverb,word,-
311,4,soon ,まもなく,in a short time,adverb,word,-
312,4,away,離れて,to a different place,adverb,word,-
313,4,together,一緒に,with other people,adverb,word,-
314,4,alone,ひとりで,without other people,adverb,word,-
315,4,maybe not,たぶん違う,probably not,phrase,phrase,-
316,4,at least,少なくとも,not less than this,phrase,phrase,-
317,4,at most,多くても,no more than this,phrase,phrase,-
318,4,more,もっと,a larger amount,adjective,word,-
319,4,less,より少ない,a smaller amount,adjective,word,-
320,4,most,いちばん多い,more than all others,adjective,word,-
321,4,least,いちばん少ない,less than all others,adjective,word,-
322,4,another ,別の,one more or a different one,adjective,word,-
323,4,each other,お互い,one person and another person,pronoun,phrase,-
324,4,both,両方とも,two together,pronoun,word,-
325,4,either A or B,AかBのどちらか,one of two choices,conjunction,phrase,A&B
326,4,neither A nor B,AもBも〜ない,not one and not the other,conjunction,phrase,A&B
327,4,something,何か,a thing not named,pronoun,word,-
328,4,anything,何でも,any thing at all,pronoun,word,-
329,4,nothing,何もない,not any thing,pronoun,word,-
330,4,someone,だれか,a person not named,pronoun,word,-
331,4,anyone,だれでも,any person at all,pronoun,word,-
332,4,everyone,みんな,all people,pronoun,word,-
333,4,nobody,だれもいない,no person,pronoun,word,-
334,4,each,それぞれ,every one one by one,pronoun,word,-
335,4,another one,もう一つ,one more thing,phrase,phrase,-
336,4,next,次の,after this one,adjective,word,-
337,4,last (final),最後の,after all others,adjective,word,-
338,4,first of all,まず最初に,in the beginning,phrase,phrase,-
339,4,once,一度,one time,adverb,word,-
340,4,twice,二度,two times,adverb,word,-
341,4,again,もう一度,one more time,adverb,word,-
342,4,ever,今までに,at any time,adverb,word,-
343,4,never ever,絶対に〜ない,not at any time at all,phrase,phrase,-
344,4,at the same time,同時に,together in time,phrase,phrase,-
345,4,on time,時間ぴったりに,at the correct time,phrase,phrase,-
346,4,in time,時間内に,before it is too late,phrase,phrase,-
347,4,late for A,Aに遅れて,not on time,phrase,phrase,A
348,4,early bird,早起きの人,a person who gets up early,noun,word,-
349,4,a.m.,午前,before noon,abbreviation,word,-
350,4,p.m.,午後,after noon,abbreviation,word,-
351,4,weekday,平日,a day from Monday to Friday,noun,word,-
352,4,holiday,休日,a day you do not work or study,noun,word,-
353,4,vacation,休み,time away from work or school,noun,word,-
354,4,trip,旅行,a short travel,noun,word,-
355,4,journey,旅,a long travel,noun,word,-
356,4,tourist,観光客,a person visiting for fun,noun,word,-
357,4,guidebook,ガイドブック,a book for travel information,noun,word,-
358,4,hotel,ホテル,a place to stay when traveling,noun,word,-
359,4,hostel,ホステル,a cheap place to stay,noun,word,-
360,4,guesthouse,民宿,a small place for travelers to stay,noun,word,-
361,4,reservation,予約,a plan to keep a seat or room,noun,word,-
362,4,check in,チェックインする,to tell a hotel you arrived,verb,phrase,-
363,4,check out,チェックアウトする,to leave a hotel after paying,verb,phrase,-
364,4,room key,部屋の鍵,a key for your room,phrase,phrase,-
365,4,lobby,ロビー,front room of a hotel,noun,word,-
366,4,elevator,エレベーター,a box that moves up and down,noun,word,-
367,4,stairs,階段,steps to go up or down,noun,word,-
368,4,entrance,入口,a place to go in,noun,word,-
369,4,exit,出口,a place to go out,noun,word,-
370,4,corridor,廊下,a long hall in a building,noun,word,-
371,4,toilet,トイレ,a room for using the toilet,noun,word,-
372,4,restroom,トイレ,a public toilet,noun,word,-
373,4,shower,シャワー,a device that sprays water,noun,word,-
374,4,bath,おふろ,a time to wash in warm water,noun,word,-
375,4,soap,せっけん,a thing used for washing,noun,word,-
376,4,shampoo,シャンプー,soap for hair,noun,word,-
377,4,toothpaste,歯みがき粉,paste for brushing teeth,noun,word,-
378,4,medicine,薬,something to help sickness,noun,word,-
379,4,fever,熱,body heat from sickness,noun,word,-
380,4,cough,せき,air coming out when sick,noun,word,-
381,4,headache,頭痛,pain in your head,noun,word,-
382,4,stomachache,腹痛,pain in your stomach,noun,word,-
383,4,hurt,痛む,to feel pain,verb,word,-
384,4,injure,けがをさせる,to hurt the body,verb,word,-
385,4,accident,事故,something bad that happens by chance,noun,word,-
386,4,police,警察,people who keep the town safe,noun,word,-
387,4,fire,火,heat and light from burning,noun,word,-
388,4,fire station,消防署,a place for firefighters,phrase,phrase,-
389,4,firefighter,消防士,a person who puts out fires,noun,word,-
390,4,ambulance,救急車,a car for sick people,noun,word,-
391,4,emergency,緊急,need for help right now,noun,word,-
392,4,danger,危険,something that can hurt you,noun,word,-
393,4,help,助け,aid from another person,noun,word,-
394,4,call for help,助けを呼ぶ,to ask for help loudly,phrase,phrase,-
395,4,report,報告する,to tell information to a person in charge,verb,word,-
396,4,rule,きまり,what you must do,noun,word,-
397,4,law,法律,rules of a country,noun,word,-
398,4,government,政府,people who run a country,noun,word,-
399,4,capital,首都,the main city of a country,noun,word,-
400,4,citizen,市民,a person who lives in a country,noun,word,-
401,4,passport,旅券,a paper for travel to other countries,noun,word,-
402,4,visa,ビザ,a paper to enter a country,noun,word,-
403,4,customs,税関,place that checks bags at an airport,noun,word,-
404,4,baggage,手荷物,bags for travel,noun,word,-
405,4,suitcase,スーツケース,a large travel bag,noun,word,-
406,4,backpack,リュック,a bag you carry on your back,noun,word,-
407,4,umbrella,かさ,a thing to stop rain,noun,word,-
408,4,raincoat,レインコート,clothes for rain,noun,word,-
409,4,weather,天気,sun rain snow and wind,noun,word,-
410,4,temperature,気温,how hot or cold it is,noun,word,-
411,4,degree,度,a unit for temperature,noun,word,-
412,4,storm,あらし,strong wind and rain,noun,word,-
413,4,thunder,かみなり,loud sound in a storm,noun,word,-
414,4,lightning,いなずま,bright light in a storm,noun,word,-
415,4,rainbow,にじ,colors in the sky after rain,noun,word,-
416,4,earthquake,地震,shaking of the ground,noun,word,-
417,4,flood,洪水,too much water in a town,noun,word,-
418,4,fireworks,花火,bright lights in the night sky,noun,word,-
419,4,festival,祭り,a special event in a town,noun,word,-
420,4,parade,パレード,people walking for a festival,noun,word,-
421,4,Christmas,クリスマス,a holiday in December,noun,word,-
422,4,New Year's Day,元日,the first day of the year,phrase,phrase,-
423,4,birthday party,誕生日会,a party for a birthday,phrase,phrase,-
424,4,present,プレゼント,a gift,noun,word,-
425,4,gift,贈り物,a present for someone,noun,word,-
426,4,card,カード,a paper to say happy birthday,noun,word,-
427,4,invitation,招待状,a letter asking you to come,noun,word,-
428,4,party,パーティー,a fun meeting with people,noun,word,-
429,4,game,ゲーム,something you play for fun,noun,word,-
430,4,puzzle,パズル,a game to think and solve,noun,word,-
431,4,quiz,クイズ,a short test game with questions,noun,word,-
432,4,contest,コンテスト,a game to find the best person,noun,word,-
433,4,prize,賞,something you get for winning,noun,word,-
434,4,win,勝つ,to be the best in a game,verb,word,-
435,4,lose,負ける,to not win,verb,word,-
436,4,score,得点,points in a game,noun,word,-
437,4,teamwork,チームワーク,working well together in a team,noun,word,-
438,4,coach,コーチ,a person who teaches a sport,noun,word,-
439,4,match,試合,a sports game,noun,word,-
440,4,practice,練習,time to train,noun,word,-
441,4,join,参加する,to become a member of a group,verb,word,-
442,4,leave,やめる,to stop being in a group,verb,word,-
443,4,take part in A,Aに参加する,to join an event,phrase,phrase,A
444,4,enter,出場する,to join a contest,verb,word,-
445,4,win a prize,賞を取る,to get a prize by winning,phrase,phrase,-
446,4,lose weight,やせる,to become less heavy,phrase,phrase,-
447,4,wear,着ている,to have clothes on your body,verb,word,-
448,4,uniform,制服,same clothes for a group,noun,word,-
449,4,school uniform,学校の制服,uniform for school,phrase,phrase,-
450,4,jeans,ジーンズ,blue pants made of strong cloth,noun,word,-
451,4,sweater,セーター,warm top clothes,noun,word,-
452,4,hoodie,パーカー,a jacket with a hood,noun,word,-
453,4,glove,手ぶくろ,clothes for your hand,noun,word,-
454,4,scarf,マフラー,cloth around your neck,noun,word,-
455,4,boots,ブーツ,strong shoes that cover the ankle,noun,word,-
456,4,sneakers,スニーカー,soft shoes for sports,noun,word,-
457,4,wear glasses,めがねをかける,to have glasses on your face,phrase,phrase,-
458,4,carry an umbrella,傘を持ち歩く,to have an umbrella with you,phrase,phrase,-
459,4,daughter,娘,a female child,noun,word,-
460,4,son,息子,a male child,noun,word,-
461,4,parents,両親,mother and father,noun,word,-
462,4,aunt,おば,a sister of your mother or father,noun,word,-
463,4,uncle,おじ,a brother of your mother or father,noun,word,-
464,4,nephew,おい,a son of your brother or sister,noun,word,-
465,4,niece,めい,a daughter of your brother or sister,noun,word,-
466,4,grandchild,孫,a child of your child,noun,word,-
467,4,couple,夫婦／カップル,two people together,noun,word,-
468,4,owner,持ち主,a person who has something,noun,word,-
469,4,guest,客,a person invited to a place,noun,word,-
470,4,host,主催者,a person who has guests,noun,word,-
471,4,sir,〜さん,a polite word for a man,noun,word,-
472,4,ma'am,〜さん,a polite word for a woman,noun,word,-
473,4,customer,客,a person who buys something,noun,word,-
474,4,clerk,店員,a person working in a shop,noun,word,-
475,4,manager ,管理者,a person who runs a place,noun,word,-
476,4,neighbor ,近所の人,a person living near you,noun,word,-
477,4,friendship,友情,being friends,noun,word,-
478,4,kindness,親切,being kind,noun,word,-
479,4,hobby,趣味,something you do for fun,noun,word,-
480,4,free time,ひまな時間,time when you are not busy,phrase,phrase,-
481,4,activity,活動,something you do,noun,word,-
482,4,lesson,授業,a time to learn,noun,word,-
483,4,class,授業,a group learning together,noun,word,-
484,4,home lesson,家庭学習,study done at home,phrase,phrase,-
485,4,exam,試験,a big test,noun,word,-
486,4,score,点数,points on a test,noun,word,-
487,4,grade,成績,a school mark,noun,word,-
488,4,pass,合格する,to finish and be okay,verb,word,-
489,4,fail,不合格になる,to not pass,verb,word,-
490,4,study hard,一生懸命勉強する,to study a lot,phrase,phrase,A
491,4,review,復習する,to study again to remember,verb,word,-
492,4,preview,予習する,to study before class,verb,word,-
493,4,translate,翻訳する,to change into another language,verb,word,-
494,4,spell,つづる,to write letters in order,verb,word,-
495,4,pronounce,発音する,to say sounds of a word,verb,word,-
496,4,memorize,暗記する,to learn by memory,verb,word,-
497,4,learn by heart,暗記する,to memorize,phrase,phrase,A
498,4,teach ,教える,to help someone learn,verb,word,-
499,4,student council,生徒会,a group of student leaders,phrase,phrase,-
500,4,university,大学,a school after high school,noun,word,-
501,4,college,大学,a school after high school,noun,word,-
502,4,high school,高校,school for older students,phrase,phrase,-
503,4,primary school,小学校,school for young children,phrase,phrase,-
504,4,school trip,修学旅行,a trip with school,phrase,phrase,-
505,4,rule (school),校則,rules in a school,noun,word,-
506,4,club activity,部活動,an after school group activity,phrase,phrase,-
507,4,team ,チーム,a group that plays together,noun,word,-
508,4,member ,メンバー,a person in a group,noun,word,-
509,4,meeting,会議,people talking for a purpose,noun,word,-
510,4,discussion ,討論,talk about ideas,noun,word,-
511,4,opinion,意見,what you think,noun,word,-
512,4,agree with A,Aに同意する,to have the same opinion,phrase,phrase,A
513,4,disagree with A,Aに反対する,to not agree,phrase,phrase,A
514,4,idea (new),アイデア,a new plan in your mind,noun,word,-
515,4,decide to A,Aすることに決める,to choose a plan,phrase,phrase,A
516,4,have to A,Aしなければならない,must do,phrase,phrase,A
517,4,must,〜しなければならない,have to,auxiliary verb,word,-
518,4,should,〜すべきだ,it is good to do,auxiliary verb,word,-
519,4,might,〜かもしれない,maybe true,auxiliary verb,word,-
520,4,will,〜するつもりだ,used to talk about the future,auxiliary verb,word,-
521,4,may I A,Aしてもいいですか,a polite request for permission,phrase,phrase,A
522,4,can I A,Aしてもいいですか,a question to ask permission,phrase,phrase,A
523,4,have a plan,計画がある,to have decided what to do,phrase,phrase,-
524,4,hope,望む,to want something to happen,verb,word,-
525,4,wish,願う,to want strongly,verb,word,-
526,4,expect,期待する,to think something will happen,verb,word,-
527,4,look for A,Aを探す,to try to find,phrase,phrase,A
528,4,search for A,Aを探す,to look carefully to find,phrase,phrase,A
529,4,look forward to A,Aを楽しみにする,to wait happily for something,phrase,phrase,A
530,4,wait for A,Aを待つ,to stay until it comes,phrase,phrase,A
531,4,on TV,テレビで,on television,phrase,phrase,-
532,4,on the radio,ラジオで,on radio,phrase,phrase,-
533,4,by bus,バスで,using a bus,phrase,phrase,-
534,4,by train,電車で,using a train,phrase,phrase,-
535,4,on foot,歩いて,by walking,phrase,phrase,-
536,4,by bike,自転車で,using a bicycle,phrase,phrase,-
537,4,by plane,飛行機で,using a plane,phrase,phrase,-
538,4,by ship,船で,using a ship,phrase,phrase,-
539,4,traffic,交通,vehicles on roads,noun,word,-
540,4,traffic jam,渋滞,many cars and slow roads,phrase,phrase,-
541,4,subway,地下鉄,a train under a city,noun,word,-
542,4,platform,ホーム,place to wait for a train,noun,word,-
543,4,subway station,地下鉄の駅,a station for the subway,phrase,phrase,-
544,4,information desk,案内所,a place to ask information,phrase,phrase,-
545,4,lost and found,遺失物取扱所,a place for lost things,phrase,phrase,-
546,4,turn right,右に曲がる,to move to the right side,phrase,phrase,-
547,4,turn left,左に曲がる,to move to the left side,phrase,phrase,-
548,4,go straight,まっすぐ行く,to go without turning,phrase,phrase,-
549,4,across the street,通りの向こう側に,on the other side of the street,phrase,phrase,-
550,4,on the corner,角に,at a street corner,phrase,phrase,-
551,4,corner,角,where two lines meet,noun,word,-
552,4,line,列,a row of people or things,noun,word,-
553,4,queue,列,line of people waiting,noun,word,-
554,4,wait in line,列に並ぶ,to stand in a line,phrase,phrase,-
555,4,way,道順／方法,how to go or how to do,noun,word,-
556,4,direction,方向,where something goes,noun,word,-
557,4,sign,標識,a board that shows direction,noun,word,-
558,4,map ,地図,a picture of an area,noun,word,-
559,4,guide,ガイド,person who shows places,noun,word,-
560,4,shopping mall,ショッピングモール,a large place with many shops,phrase,phrase,-
561,4,department store,デパート,a large store with many parts,phrase,phrase,-
562,4,bakery,パン屋,a shop that sells bread,noun,word,-
563,4,bookstore,本屋,a shop that sells books,noun,word,-
564,4,flower shop,花屋,a shop that sells flowers,phrase,phrase,-
565,4,pharmacy,薬局,a shop for medicine,noun,word,-
566,4,clinic,診療所,a small place to see a doctor,noun,word,-
567,4,hotel room,ホテルの部屋,a room in a hotel,phrase,phrase,-
568,4,price tag,値札,a small paper that shows price,phrase,phrase,-
569,4,menu,メニュー,list of food and drinks,noun,word,-
570,4,order,注文,what you asked a shop for,noun,word,-
571,4,waiter,給仕,person who serves food,noun,word,-
572,4,cook,料理人,person who cooks food,noun,word,-
573,4,chef,シェフ,main cook in a kitchen,noun,word,-
574,4,kitchen staff,厨房スタッフ,people who work in a kitchen,phrase,phrase,-
575,4,fork ,フォーク,tool to eat food,noun,word,-
576,4,spoon ,スプーン,tool to eat soup,noun,word,-
577,4,knife ,ナイフ,tool to cut food,noun,word,-
578,4,plate ,皿,flat dish for food,noun,word,-
579,4,bowl,ボウル,round dish for food,noun,word,-
580,4,cup ,カップ,small dish for drinks,noun,word,-
581,4,bottle,びん,a container with a neck,noun,word,-
582,4,can,かん,metal container for drinks,noun,word,-
583,4,straw,ストロー,tube for drinking,noun,word,-
584,4,napkin,ナプキン,cloth or paper to clean your mouth,noun,word,-
585,4,steak,ステーキ,thick cooked meat,noun,word,-
586,4,noodles,めん,food like long strings,noun,word,-
587,4,dessert,デザート,sweet food after a meal,noun,word,-
588,4,snack,軽食,a small food between meals,noun,word,-
589,4,breakfast set,朝食セット,a set meal for breakfast,phrase,phrase,-
590,4,vegetarian,菜食の,not eating meat,adjective,word,-
591,4,allergic,アレルギーの,not able to eat or touch some things,adjective,word,-
592,4,allergy,アレルギー,a health problem from some foods,noun,word,-
593,4,recipe,レシピ,how to cook a dish,noun,word,-
594,4,ingredient,材料,one thing used to make food,noun,word,-
595,4,boil water,お湯を沸かす,to make water very hot,phrase,phrase,-
596,4,heat,温める,to make warmer,verb,word,-
597,4,freeze,凍る,to become ice,verb,word,-
598,4,ice,氷,frozen water,noun,word,-
599,4,fridge,冷蔵庫,a machine that keeps food cold,noun,word,-
600,4,freezer,冷凍庫,a machine that keeps things frozen,noun,word,-
601,4,trash,ごみ,things you throw away,noun,word,-
602,4,garbage,ごみ,trash,noun,word,-
603,4,recycle,リサイクルする,to use again after making new,verb,word,-
604,4,environment,環境,air water and land around us,noun,word,-
605,4,nature,自然,plants animals and land,noun,word,-
606,4,protect nature,自然を守る,to keep nature safe,phrase,phrase,-
607,4,animal shelter,動物保護施設,a place that keeps lost animals,phrase,phrase,-
608,4,pet,ペット,an animal you keep at home,noun,word,-
609,4,hamster,ハムスター,a small pet animal,noun,word,-
610,4,parrot,オウム,a bird that can copy sounds,noun,word,-
611,4,turtle,かめ,an animal with a hard shell,noun,word,-
612,4,spider,くも,small animal with eight legs,noun,word,-
613,4,insect,昆虫,a small animal with six legs,noun,word,-
614,4,butterfly,ちょう,a flying insect with wings,noun,word,-
615,4,bee,はち,insect that makes honey,noun,word,-
616,4,ant,あり,a small insect that walks in lines,noun,word,-
617,4,feed a pet,ペットにえさをやる,to give food to a pet,phrase,phrase,-
618,4,walk the dog,犬を散歩させる,to take a dog for a walk,phrase,phrase,-
619,4,yard,庭,land next to a house,noun,word,-
620,4,field,野原,open land,noun,word,-
621,4,farm,農場,place where farmers work,noun,word,-
622,4,farmer,農家,a person who works on a farm,noun,word,-
623,4,harvest,収穫,to pick plants for food,verb,word,-
624,4,flowerbed,花だん,a place where flowers grow,noun,word,-
625,4,toolbox,道具箱,a box for tools,noun,word,-
626,4,hammer,かなづち,tool to hit nails,noun,word,-
627,4,nail,くぎ,metal pin used in wood,noun,word,-
628,4,screw,ねじ,metal pin that turns,noun,word,-
629,4,screwdriver,ドライバー,tool to turn a screw,noun,word,-
630,4,measure,測る,to find size or amount,verb,word,-
631,4,meter,メートル,unit of length,noun,word,-
632,4,kilometer,キロメートル,1000 meters,noun,word,-
633,4,centimeter,センチ,one hundredth of a meter,noun,word,-
634,4,gram,グラム,unit of weight,noun,word,-
635,4,kilogram,キログラム,1000 grams,noun,word,-
636,4,liter,リットル,unit of liquid amount,noun,word,-
637,4,percent,パーセント,out of 100,noun,word,-
638,4,price ,料金,cost in money,noun,word,-
639,4,cheap enough,買えるくらい安い,not too expensive,phrase,phrase,-
640,4,expensive but good,高いが良い,high price and high quality,phrase,phrase,-
641,4,quality,品質,how good something is,noun,word,-
642,4,product,製品,something made to sell,noun,word,-
643,4,service,サービス,help from a shop or company,noun,word,-
644,4,customer service,お客様対応,help for customers,phrase,phrase,-
645,4,problem,問題,a thing that is not good,noun,word,-
646,4,solution,解決策,a way to fix a problem,noun,word,-
647,4,idea for A,Aの案,a plan for something,phrase,phrase,A
648,4,improve,改善する,to make better,verb,word,-
649,4,reduce,減らす,to make less,verb,word,-
650,4,increase,増やす,to make more,verb,word,-
651,4,collect,集める,to bring many together,verb,word,-
652,4,collection,コレクション,many things kept together,noun,word,-
653,4,stamp,切手,a small paper for mail,noun,word,-
654,4,postcard,はがき,a card you send by mail,noun,word,-
655,4,envelope,封筒,paper cover for a letter,noun,word,-
656,4,package,小包,box sent by mail,noun,word,-
657,4,deliver,配達する,to take a package to a home,verb,word,-
658,4,delivery,配達,taking packages to people,noun,word,-
659,4,address,住所,place where a person lives,noun,word,-
660,4,contact,連絡,to speak or write to someone,noun,word,-
661,4,contact A,Aに連絡する,to get in touch,phrase,phrase,A
662,4,appointment,約束,a planned meeting time,noun,word,-
663,4,calendar app,カレンダーアプリ,phone tool to plan days,phrase,phrase,-
664,4,meeting place,待ち合わせ場所,place to meet,phrase,phrase,-
665,4,agree to meet,会う約束をする,to decide to meet,phrase,phrase,-
666,4,be ready,準備ができている,prepared now,phrase,phrase,-
667,4,get ready,準備する,to become ready,phrase,phrase,-
668,4,as soon as possible,できるだけ早く,as quickly as you can,phrase,phrase,-
669,4,right away ,すぐに,immediately,phrase,phrase,-
670,4,for a while,しばらく,for some time,phrase,phrase,-
671,4,once in a while,たまに,sometimes,phrase,phrase,-
672,4,from now,今から,starting now,phrase,phrase,-
673,4,until then,それまで,up to that time,phrase,phrase,-
674,4,at the end,最後に,in the final part,phrase,phrase,-
675,4,in the middle,真ん中に,in the center,phrase,phrase,-
676,4,at the beginning,最初に,in the first part,phrase,phrase,-
677,4,for example,例えば,as an example,phrase,phrase,-
678,4,by the way,ところで,used to change the topic,phrase,phrase,-
679,4,anyway,とにかく,used to go back to a main point,adverb,word,-
680,4,at least once,少なくとも一度,not less than one time,phrase,phrase,-
681,4,more and more,ますます,increasing over time,phrase,phrase,-
682,4,less and less,だんだん少なく,becoming smaller over time,phrase,phrase,-
683,4,be careful,気をつけて,used to warn,phrase,phrase,A
684,4,watch out,気をつけて,be careful,phrase,phrase,A
685,4,good luck,がんばって,words to wish success,phrase,phrase,-
686,4,congratulations,おめでとう,words to say someone did well,interjection,word,-
687,4,well done,よくやった,words to praise,phrase,phrase,-
688,4,I'm glad,うれしい,words that show happiness,phrase,phrase,-
689,4,I'm worried,心配だ,words that show worry,phrase,phrase,-
690,4,be in trouble,困っている,have a serious problem,phrase,phrase,-
691,4,solve,解決する,to find an answer to a problem,verb,word,-
692,4,idea,解決の案,a plan to solve something,noun,word,-
693,4,impossible to A,Aするのは無理,not possible to do,phrase,phrase,A
694,4,possible to A,Aできる,able to do,phrase,phrase,A
695,4,only,〜だけ,just one and no more,adverb,word,-
696,4,almost,ほとんど,nearly,adverb,word,-
697,4,nearly,ほとんど,almost,adverb,word,-
698,4,exact,正確な,fully correct,adjective,word,-
699,4,exactly right,その通り,completely correct,phrase,phrase,-
700,4,once more,もう一度,again,phrase,phrase,-
1,3,actively,積極的に・活発に,in an active way,adverb,word,-
2,3,frequently,頻繁に・よく,many times,adverb,word,-
3,3,simply,単純に・簡単に,in a simple way,adverb,word,-
